{
  "name": "better-harness",
  "displayName": "Better Harness",
  "version": "0.7.0-alpha2",
  "description": "Build an AI-ready engineering system for safe coding-agent delivery and continuous software improvement.",
  "author": {
    "name": "Qoder",
    "email": "dev@qoder.com"
  },
  "homepage": "https://github.com/QoderAI/better-harness",
  "repository": "https://github.com/QoderAI/better-harness",
  "license": "MIT",
  "keywords": [
    "qoder-plugin",
    "better-harness",
    "ai-delivery",
    "continuous-improvement",
    "agent-harness",
    "change-confidence"
  ],
  "category": "Coding",
  "tags": [
    "better-harness",
    "project-harness",
    "engineering-fluency",
    "agent-guardrails",
    "continuous-improvement"
  ],
  "skills": "./skills/"
}
