{
  "name": "better-harness",
  "description": "Build an AI-ready engineering system for safe coding-agent delivery and continuous software improvement.",
  "version": "0.7.0-alpha2",
  "author": {
    "name": "Qoder",
    "email": "dev@qoder.com"
  },
  "homepage": "https://github.com/QoderAI/better-harness",
  "repository": "https://github.com/QoderAI/better-harness",
  "license": "MIT",
  "keywords": [
    "skills",
    "better-harness",
    "ai-delivery",
    "continuous-improvement",
    "agent-harness",
    "change-confidence"
  ]
}
